{
  "entry_hash": "sha256:9c5fa7b8366bb483468a32cba86a0321eabb676153413e4538d9a7e54ccb5cfe",
  "entry_id": "LEDGER-EV-EXAMPLE-001-20260708T160300764556Z",
  "evidence_hash": "sha256:bd4329625419945f17e34ab8929d9ccc5fcc2f5ee223f58cd0d45faee1b8a801",
  "evidence_id": "EV-EXAMPLE-001",
  "evidence_path": "artifacts/examples/evidence_record.example.json",
  "ledger_version": "1.0",
  "predecessor_entry_hash": "sha256:8158b1beb89da987a34a574cda2a126ad81c0a28a823dec8d59ef65cc3202e23",
  "producer": "human-operator",
  "recorded_at": "2026-07-08T16:03:00.780187Z",
  "retention_class": "50y",
  "subject": "system-alignment",
  "validation_decision": "pass",
  "validator_schema": "aso.evidence.validate.v1"
}
