{
  "entry_hash": "sha256:828981a7bfe7cbab5b636fb2258bc010f0d755f2118cd8376b602b9acb9ee4b1",
  "entry_id": "LEDGER-EV-EXAMPLE-001-20260708T160030972965Z",
  "evidence_hash": "sha256:5ee4a0299e00758755b5c754bc5963b4454ab89334f4960998820fd89b5d6384",
  "evidence_id": "EV-EXAMPLE-001",
  "evidence_path": "artifacts/examples/evidence_record.example.json",
  "ledger_version": "1.0",
  "predecessor_entry_hash": "sha256:065ad51bc7151c00411723a85e3e682b40b91a60c973ecbd24cc17e678a54568",
  "producer": "human-operator",
  "recorded_at": "2026-07-08T16:00:30.972965Z",
  "retention_class": "50y",
  "subject": "system-alignment",
  "validation_decision": "pass",
  "validator_schema": "aso.evidence.validate.v1"
}
